{
 "NotebookModel": "G53SX",
 "Author": "flexbrane",
 "EcPollInterval": 300,
 "ReadWriteWords": false,
 "CriticalTemperature": 85,
 "FanConfigurations": [
	{
	 "ReadRegister": 152,
	 "WriteRegister": 152,
	 "MinSpeedValue": 0,
	 "MaxSpeedValue": 7,
	 "IndependentReadMinMaxValues": false,
	 "MinSpeedValueRead": 0,
	 "MaxSpeedValueRead": 0,
	 "ResetRequired": true,
	 "FanSpeedResetValue": 1,
	 "FanDisplayName": "CPU",
	 "TemperatureThresholds": [
	  {
	   "UpThreshold": 55,
	   "DownThreshold": 0,
	   "FanSpeed": 0.0
	  },
	  {
	   "UpThreshold": 60,
	   "DownThreshold": 50,
	   "FanSpeed": 14.2857151
	  },
	  {
	   "UpThreshold": 65,
	   "DownThreshold": 55,
	   "FanSpeed": 28.57143
	  },
	  {
	   "UpThreshold": 70,
	   "DownThreshold": 55,
	   "FanSpeed": 42.8571434
	  },
	  {
	   "UpThreshold": 75,
	   "DownThreshold": 60,
	   "FanSpeed": 71.42857
	  },
	  {
	   "UpThreshold": 80,
	   "DownThreshold": 65,
	   "FanSpeed": 85.71429
	  },
	  {
	   "UpThreshold": 85,
	   "DownThreshold": 70,
	   "FanSpeed": 100.0
	  }
	 ],
	 "FanSpeedPercentageOverrides": []
	},
	{
	 "ReadRegister": 151,
	 "WriteRegister": 151,
	 "MinSpeedValue": 0,
	 "MaxSpeedValue": 6,
	 "IndependentReadMinMaxValues": false,
	 "MinSpeedValueRead": 0,
	 "MaxSpeedValueRead": 0,
	 "ResetRequired": true,
	 "FanSpeedResetValue": 1,
	 "FanDisplayName": "GPU",
	 "TemperatureThresholds": [
	  {
	   "UpThreshold": 60,
	   "DownThreshold": 0,
	   "FanSpeed": 0.0
	  },
	  {
	   "UpThreshold": 65,
	   "DownThreshold": 55,
	   "FanSpeed": 16.6666679
	  },
	  {
	   "UpThreshold": 70,
	   "DownThreshold": 55,
	   "FanSpeed": 16.6666679
	  },
	  {
	   "UpThreshold": 75,
	   "DownThreshold": 60,
	   "FanSpeed": 33.3333359
	  },
	  {
	   "UpThreshold": 80,
	   "DownThreshold": 65,
	   "FanSpeed": 50.0
	  },
	  {
	   "UpThreshold": 85,
	   "DownThreshold": 70,
	   "FanSpeed": 66.66667
	  },
	  {
	   "UpThreshold": 85,
	   "DownThreshold": 65,
	   "FanSpeed": 100.0
	  }
	 ],
	 "FanSpeedPercentageOverrides": []
	}
 ],
 "RegisterWriteConfigurations": []
}