{
 "LegacyTemperatureThresholdsBehaviour": true,
 "NotebookModel": "HP EliteBook Folio 1040 G1",
 "Author": "Daniel Andersen",
 "EcPollInterval": 3000,
 "ReadWriteWords": false,
 "CriticalTemperature": 90,
 "FanConfigurations": [
	{
	 "ReadRegister": 46,
	 "WriteRegister": 47,
	 "MinSpeedValue": 90,
	 "MaxSpeedValue": 34,
	 "IndependentReadMinMaxValues": false,
	 "MinSpeedValueRead": 0,
	 "MaxSpeedValueRead": 0,
	 "ResetRequired": true,
	 "FanSpeedResetValue": 255,
	 "FanDisplayName": "CPU Fan",
	 "TemperatureThresholds": [
	  {
	   "UpThreshold": 0,
	   "DownThreshold": 0,
	   "FanSpeed": 0.0
	  },
	  {
	   "UpThreshold": 60,
	   "DownThreshold": 48,
	   "FanSpeed": 10.0
	  },
	  {
	   "UpThreshold": 63,
	   "DownThreshold": 55,
	   "FanSpeed": 20.0
	  },
	  {
	   "UpThreshold": 66,
	   "DownThreshold": 59,
	   "FanSpeed": 50.0
	  },
	  {
	   "UpThreshold": 68,
	   "DownThreshold": 63,
	   "FanSpeed": 70.0
	  },
	  {
	   "UpThreshold": 71,
	   "DownThreshold": 67,
	   "FanSpeed": 100.0
	  }
	 ],
	 "FanSpeedPercentageOverrides": [
	  {
	   "FanSpeedPercentage": 0.0,
	   "FanSpeedValue": 255,
	   "TargetOperation": "ReadWrite"
	  }
	 ]
	}
 ],
 "RegisterWriteConfigurations": [
	{
	 "WriteMode": "Set",
	 "WriteOccasion": "OnInitialization",
	 "Register": 34,
	 "Value": 1,
	 "ResetRequired": true,
	 "ResetValue": 1,
	 "ResetWriteMode": "Set",
	 "Description": "Select thermal zone"
	},
	{
	 "WriteMode": "Set",
	 "WriteOccasion": "OnInitialization",
	 "Register": 38,
	 "Value": 28,
	 "ResetRequired": true,
	 "ResetValue": 0,
	 "ResetWriteMode": "Set",
	 "Description": "Fake thermal zone temperature"
	}
 ]
}