{
 "LegacyTemperatureThresholdsBehaviour": true,
 "NotebookModel": "HP ENVY m6-1254eo Notebook PC",
 "Author": "Brian Nelson",
 "EcPollInterval": 1000,
 "ReadWriteWords": false,
 "CriticalTemperature": 85,
 "FanConfigurations": [
	{
	 "ReadRegister": 17,
	 "WriteRegister": 20,
	 "MinSpeedValue": 30,
	 "MaxSpeedValue": 68,
	 "IndependentReadMinMaxValues": false,
	 "MinSpeedValueRead": 0,
	 "MaxSpeedValueRead": 0,
	 "ResetRequired": false,
	 "FanSpeedResetValue": 0,
	 "FanDisplayName": "CPU Fan",
	 "TemperatureThresholds": [
	  {
	   "UpThreshold": 50,
	   "DownThreshold": 40,
	   "FanSpeed": 25.0
	  },
	  {
	   "UpThreshold": 80,
	   "DownThreshold": 70,
	   "FanSpeed": 100.0
	  },
	  {
	   "UpThreshold": 40,
	   "DownThreshold": 30,
	   "FanSpeed": 20.0
	  },
	  {
	   "UpThreshold": 20,
	   "DownThreshold": 0,
	   "FanSpeed": 10.0
	  },
	  {
	   "UpThreshold": 70,
	   "DownThreshold": 60,
	   "FanSpeed": 77.5
	  },
	  {
	   "UpThreshold": 60,
	   "DownThreshold": 50,
	   "FanSpeed": 47.5
	  }
	 ],
	 "FanSpeedPercentageOverrides": [
	  {
	   "FanSpeedPercentage": 76.92308,
	   "FanSpeedValue": 39,
	   "TargetOperation": "ReadWrite"
	  },
	  {
	   "FanSpeedPercentage": 38.46154,
	   "FanSpeedValue": 34,
	   "TargetOperation": "ReadWrite"
	  }
	 ]
	}
 ],
 "RegisterWriteConfigurations": [
	{
	 "WriteMode": "Or",
	 "WriteOccasion": "OnInitialization",
	 "Register": 15,
	 "Value": 8,
	 "ResetRequired": true,
	 "ResetValue": 5,
	 "ResetWriteMode": "Set",
	 "Description": "Manual Override"
	}
 ]
}