{
 "NotebookModel": "HP ProBook 6550b",
 "Author": "djbozkosz",
 "EcPollInterval": 500,
 "ReadWriteWords": false,
 "CriticalTemperature": 80,
 "FanConfigurations": [
	{
	 "ReadRegister": 215,
	 "WriteRegister": 214,
	 "MinSpeedValue": 30,
	 "MaxSpeedValue": 100,
	 "IndependentReadMinMaxValues": false,
	 "MinSpeedValueRead": 0,
	 "MaxSpeedValueRead": 0,
	 "ResetRequired": false,
	 "FanSpeedResetValue": 20,
	 "FanDisplayName": "CPU Fan",
	 "TemperatureThresholds": [
	  {
	   "UpThreshold": 40,
	   "DownThreshold": 0,
	   "FanSpeed": 0.0
	  },
	  {
	   "UpThreshold": 45,
	   "DownThreshold": 35,
	   "FanSpeed": 30.0
	  },
	  {
	   "UpThreshold": 50,
	   "DownThreshold": 40,
	   "FanSpeed": 50.0
	  },
	  {
	   "UpThreshold": 55,
	   "DownThreshold": 45,
	   "FanSpeed": 80.0
	  },
	  {
	   "UpThreshold": 80,
	   "DownThreshold": 50,
	   "FanSpeed": 100.0
	  }
	 ],
	 "FanSpeedPercentageOverrides": []
	}
 ],
 "RegisterWriteConfigurations": []
}