{
 "NotebookModel": "HP OMEN 5001NG",
 "Author": "Eberh@rd",
 "EcPollInterval": 2222,
 "ReadWriteWords": false,
 "CriticalTemperature": 80,
 "FanConfigurations": [
	{
	 "ReadRegister": 149,
	 "WriteRegister": 148,
	 "MinSpeedValue": 255,
	 "MaxSpeedValue": 58,
	 "IndependentReadMinMaxValues": false,
	 "MinSpeedValueRead": 0,
	 "MaxSpeedValueRead": 0,
	 "ResetRequired": false,
	 "FanSpeedResetValue": 89,
	 "FanDisplayName": "CPU fan",
	 "TemperatureThresholds": [
	  {
	   "UpThreshold": 70,
	   "DownThreshold": 0,
	   "FanSpeed": 0.0
	  },
	  {
	   "UpThreshold": 75,
	   "DownThreshold": 56,
	   "FanSpeed": 10.0
	  },
	  {
	   "UpThreshold": 76,
	   "DownThreshold": 65,
	   "FanSpeed": 20.0
	  },
	  {
	   "UpThreshold": 77,
	   "DownThreshold": 66,
	   "FanSpeed": 30.0
	  },
	  {
	   "UpThreshold": 78,
	   "DownThreshold": 67,
	   "FanSpeed": 50.0
	  },
	  {
	   "UpThreshold": 80,
	   "DownThreshold": 68,
	   "FanSpeed": 100.0
	  }
	 ],
	 "FanSpeedPercentageOverrides": []
	}
 ],
 "RegisterWriteConfigurations": [
	{
	 "WriteMode": "Set",
	 "WriteOccasion": "OnInitialization",
	 "Register": 147,
	 "Value": 20,
	 "ResetRequired": true,
	 "ResetValue": 4,
	 "ResetWriteMode": "Set",
	 "Description": "CPU fan init"
	}
 ]
}