{
 "LegacyTemperatureThresholdsBehaviour": true,
 "NotebookModel": "HP ProBook 650 G2",
 "Author": "Christian Malek",
 "EcPollInterval": 3000,
 "ReadWriteWords": false,
 "CriticalTemperature": 75,
 "FanConfigurations": [
	{
	 "ReadRegister": 46,
	 "WriteRegister": 47,
	 "MinSpeedValue": 123,
	 "MaxSpeedValue": 48,
	 "IndependentReadMinMaxValues": false,
	 "MinSpeedValueRead": 0,
	 "MaxSpeedValueRead": 0,
	 "ResetRequired": true,
	 "FanSpeedResetValue": 255,
	 "FanDisplayName": "CPU fan",
	 "TemperatureThresholds": [
	  {
	   "UpThreshold": 0,
	   "DownThreshold": 0,
	   "FanSpeed": 20.0
	  },
	  {
	   "UpThreshold": 66,
	   "DownThreshold": 59,
	   "FanSpeed": 50.0
	  },
	  {
	   "UpThreshold": 71,
	   "DownThreshold": 65,
	   "FanSpeed": 100.0
	  }
	 ],
	 "FanSpeedPercentageOverrides": [
	  {
	   "FanSpeedPercentage": 0.0,
	   "FanSpeedValue": 254,
	   "TargetOperation": "ReadWrite"
	  },
	  {
	   "FanSpeedPercentage": 0.0,
	   "FanSpeedValue": 255,
	   "TargetOperation": "Read"
	  }
	 ]
	}
 ],
 "RegisterWriteConfigurations": [
	{
	 "WriteMode": "Set",
	 "WriteOccasion": "OnInitialization",
	 "Register": 34,
	 "Value": 1,
	 "ResetRequired": true,
	 "ResetValue": 1,
	 "ResetWriteMode": "Set",
	 "Description": "Select thermal zone"
	},
	{
	 "WriteMode": "Set",
	 "WriteOccasion": "OnInitialization",
	 "Register": 38,
	 "Value": 28,
	 "ResetRequired": true,
	 "ResetValue": 0,
	 "ResetWriteMode": "Set",
	 "Description": "Fake thermal zone temperature"
	}
 ]
}