{
 "NotebookModel": "UX310UAK",
 "Author": "xant1, jws, fredo61",
 "EcPollInterval": 100,
 "ReadWriteWords": false,
 "CriticalTemperature": 85,
 "FanConfigurations": [
	{
	 "ReadRegister": 151,
	 "WriteRegister": 151,
	 "MinSpeedValue": 0,
	 "MaxSpeedValue": 8,
	 "IndependentReadMinMaxValues": false,
	 "MinSpeedValueRead": 0,
	 "MaxSpeedValueRead": 0,
	 "ResetRequired": true,
	 "FanSpeedResetValue": 9,
	 "FanDisplayName": "CPU Fan",
	 "TemperatureThresholds": [
	  {
	   "UpThreshold": 65,
	   "DownThreshold": 0,
	   "FanSpeed": 0.0
	  },
	  {
	   "UpThreshold": 70,
	   "DownThreshold": 50,
	   "FanSpeed": 12.5
	  },
	  {
	   "UpThreshold": 75,
	   "DownThreshold": 60,
	   "FanSpeed": 25.0
	  },
	  {
	   "UpThreshold": 77,
	   "DownThreshold": 65,
	   "FanSpeed": 50.0
	  },
	  {
	   "UpThreshold": 80,
	   "DownThreshold": 67,
	   "FanSpeed": 75.0
	  },
	  {
	   "UpThreshold": 85,
	   "DownThreshold": 70,
	   "FanSpeed": 100.0
	  }
	 ],
	 "FanSpeedPercentageOverrides": []
	}
 ],
 "RegisterWriteConfigurations": [
	{
	 "WriteMode": "Set",
	 "WriteOccasion": "OnWriteFanSpeed",
	 "Register": 160,
	 "Value": 10,
	 "ResetRequired": true,
	 "ResetValue": 10,
	 "ResetWriteMode": "Set",
	 "Description": "UnknownButWorks1"
	},
	{
	 "WriteMode": "Set",
	 "WriteOccasion": "OnWriteFanSpeed",
	 "Register": 166,
	 "Value": 10,
	 "ResetRequired": true,
	 "ResetValue": 10,
	 "ResetWriteMode": "Set",
	 "Description": "UnknownButWorks2"
	}
 ]
}