{
 "NotebookModel": "G752VS",
 "Author": "Slartibartfast",
 "EcPollInterval": 150,
 "ReadWriteWords": false,
 "CriticalTemperature": 90,
 "FanConfigurations": [
	{
	 "ReadRegister": 151,
	 "WriteRegister": 151,
	 "MinSpeedValue": 0,
	 "MaxSpeedValue": 8,
	 "IndependentReadMinMaxValues": false,
	 "MinSpeedValueRead": 0,
	 "MaxSpeedValueRead": 0,
	 "ResetRequired": true,
	 "FanSpeedResetValue": 8,
	 "FanDisplayName": "CPU FAN",
	 "TemperatureThresholds": [
	  {
	   "UpThreshold": 65,
	   "DownThreshold": 0,
	   "FanSpeed": 0.0
	  },
	  {
	   "UpThreshold": 70,
	   "DownThreshold": 55,
	   "FanSpeed": 25.0
	  },
	  {
	   "UpThreshold": 80,
	   "DownThreshold": 60,
	   "FanSpeed": 50.0
	  },
	  {
	   "UpThreshold": 85,
	   "DownThreshold": 65,
	   "FanSpeed": 75.0
	  },
	  {
	   "UpThreshold": 90,
	   "DownThreshold": 75,
	   "FanSpeed": 100.0
	  }
	 ],
	 "FanSpeedPercentageOverrides": []
	},
	{
	 "ReadRegister": 152,
	 "WriteRegister": 152,
	 "MinSpeedValue": 0,
	 "MaxSpeedValue": 8,
	 "IndependentReadMinMaxValues": false,
	 "MinSpeedValueRead": 0,
	 "MaxSpeedValueRead": 0,
	 "ResetRequired": true,
	 "FanSpeedResetValue": 8,
	 "FanDisplayName": "GPU FAN",
	 "TemperatureThresholds": [
	  {
	   "UpThreshold": 65,
	   "DownThreshold": 0,
	   "FanSpeed": 0.0
	  },
	  {
	   "UpThreshold": 70,
	   "DownThreshold": 55,
	   "FanSpeed": 25.0
	  },
	  {
	   "UpThreshold": 80,
	   "DownThreshold": 60,
	   "FanSpeed": 50.0
	  },
	  {
	   "UpThreshold": 85,
	   "DownThreshold": 65,
	   "FanSpeed": 75.0
	  },
	  {
	   "UpThreshold": 90,
	   "DownThreshold": 75,
	   "FanSpeed": 100.0
	  }
	 ],
	 "FanSpeedPercentageOverrides": []
	}
 ],
 "RegisterWriteConfigurations": [
	{
	 "WriteMode": "Set",
	 "WriteOccasion": "OnWriteFanSpeed",
	 "Register": 160,
	 "Value": 10,
	 "ResetRequired": true,
	 "ResetValue": 10,
	 "ResetWriteMode": "Set",
	 "Description": "CPU FAN"
	},
	{
	 "WriteMode": "Set",
	 "WriteOccasion": "OnWriteFanSpeed",
	 "Register": 166,
	 "Value": 10,
	 "ResetRequired": true,
	 "ResetValue": 10,
	 "ResetWriteMode": "Set",
	 "Description": "GPU FAN"
	}
 ]
}