{
 "NotebookModel": "Sony Corporation VGN-CR392_W",
 "Author": "Kevin-KD",
 "EcPollInterval": 100,
 "ReadWriteWords": false,
 "CriticalTemperature": 75,
 "FanConfigurations": [
	{
	 "ReadRegister": 91,
	 "WriteRegister": 91,
	 "MinSpeedValue": 142,
	 "MaxSpeedValue": 210,
	 "IndependentReadMinMaxValues": false,
	 "MinSpeedValueRead": 0,
	 "MaxSpeedValueRead": 0,
	 "ResetRequired": false,
	 "FanSpeedResetValue": 0,
	 "FanDisplayName": "Fan",
	 "TemperatureThresholds": [
	  {
	   "UpThreshold": 60,
	   "DownThreshold": 0,
	   "FanSpeed": 0.0
	  },
	  {
	   "UpThreshold": 63,
	   "DownThreshold": 48,
	   "FanSpeed": 10.0
	  },
	  {
	   "UpThreshold": 66,
	   "DownThreshold": 55,
	   "FanSpeed": 20.0
	  },
	  {
	   "UpThreshold": 68,
	   "DownThreshold": 59,
	   "FanSpeed": 50.0
	  },
	  {
	   "UpThreshold": 71,
	   "DownThreshold": 63,
	   "FanSpeed": 70.0
	  },
	  {
	   "UpThreshold": 75,
	   "DownThreshold": 67,
	   "FanSpeed": 100.0
	  }
	 ],
	 "FanSpeedPercentageOverrides": [
	  {
	   "FanSpeedPercentage": 0.0,
	   "FanSpeedValue": 0,
	   "TargetOperation": "ReadWrite"
	  }
	 ]
	},
	{
	 "ReadRegister": 92,
	 "WriteRegister": 92,
	 "MinSpeedValue": 142,
	 "MaxSpeedValue": 210,
	 "IndependentReadMinMaxValues": false,
	 "MinSpeedValueRead": 0,
	 "MaxSpeedValueRead": 0,
	 "ResetRequired": false,
	 "FanSpeedResetValue": 0,
	 "FanDisplayName": "Fan",
	 "TemperatureThresholds": [
	  {
	   "UpThreshold": 60,
	   "DownThreshold": 0,
	   "FanSpeed": 0.0
	  },
	  {
	   "UpThreshold": 63,
	   "DownThreshold": 48,
	   "FanSpeed": 10.0
	  },
	  {
	   "UpThreshold": 66,
	   "DownThreshold": 55,
	   "FanSpeed": 20.0
	  },
	  {
	   "UpThreshold": 68,
	   "DownThreshold": 59,
	   "FanSpeed": 50.0
	  },
	  {
	   "UpThreshold": 71,
	   "DownThreshold": 63,
	   "FanSpeed": 70.0
	  },
	  {
	   "UpThreshold": 75,
	   "DownThreshold": 67,
	   "FanSpeed": 100.0
	  }
	 ],
	 "FanSpeedPercentageOverrides": [
	  {
	   "FanSpeedPercentage": 0.0,
	   "FanSpeedValue": 0,
	   "TargetOperation": "ReadWrite"
	  }
	 ]
	},
	{
	 "ReadRegister": 93,
	 "WriteRegister": 93,
	 "MinSpeedValue": 142,
	 "MaxSpeedValue": 210,
	 "IndependentReadMinMaxValues": false,
	 "MinSpeedValueRead": 0,
	 "MaxSpeedValueRead": 0,
	 "ResetRequired": false,
	 "FanSpeedResetValue": 0,
	 "FanDisplayName": "Fan",
	 "TemperatureThresholds": [
	  {
	   "UpThreshold": 60,
	   "DownThreshold": 0,
	   "FanSpeed": 0.0
	  },
	  {
	   "UpThreshold": 63,
	   "DownThreshold": 48,
	   "FanSpeed": 10.0
	  },
	  {
	   "UpThreshold": 66,
	   "DownThreshold": 55,
	   "FanSpeed": 20.0
	  },
	  {
	   "UpThreshold": 68,
	   "DownThreshold": 59,
	   "FanSpeed": 50.0
	  },
	  {
	   "UpThreshold": 71,
	   "DownThreshold": 63,
	   "FanSpeed": 70.0
	  },
	  {
	   "UpThreshold": 75,
	   "DownThreshold": 67,
	   "FanSpeed": 100.0
	  }
	 ],
	 "FanSpeedPercentageOverrides": [
	  {
	   "FanSpeedPercentage": 0.0,
	   "FanSpeedValue": 0,
	   "TargetOperation": "ReadWrite"
	  }
	 ]
	}
 ],
 "RegisterWriteConfigurations": [
	{
	 "WriteMode": "Set",
	 "WriteOccasion": "OnWriteFanSpeed",
	 "Register": 65,
	 "Value": 19,
	 "ResetRequired": false,
	 "ResetValue": 0,
	 "ResetWriteMode": "Set",
	 "Description": "Switch on fan"
	}
 ]
}