{
 "NotebookModel": "Acer Aspire VN7-572G",
 "Author": "Ivo Pischner",
 "EcPollInterval": 3000,
 "ReadWriteWords": false,
 "CriticalTemperature": 80,
 "FanConfigurations": [
	{
	 "ReadRegister": 149,
	 "WriteRegister": 148,
	 "MinSpeedValue": 255,
	 "MaxSpeedValue": 98,
	 "IndependentReadMinMaxValues": false,
	 "MinSpeedValueRead": 0,
	 "MaxSpeedValueRead": 0,
	 "ResetRequired": true,
	 "FanSpeedResetValue": 255,
	 "FanDisplayName": "Fan",
	 "TemperatureThresholds": [
	  {
	   "UpThreshold": 66,
	   "DownThreshold": 0,
	   "FanSpeed": 0.0
	  },
	  {
	   "UpThreshold": 68,
	   "DownThreshold": 59,
	   "FanSpeed": 10.191083
	  },
	  {
	   "UpThreshold": 71,
	   "DownThreshold": 63,
	   "FanSpeed": 32.4840775
	  },
	  {
	   "UpThreshold": 80,
	   "DownThreshold": 67,
	   "FanSpeed": 100.0
	  }
	 ],
	 "FanSpeedPercentageOverrides": []
	}
 ],
 "RegisterWriteConfigurations": [
	{
	 "WriteMode": "Set",
	 "WriteOccasion": "OnInitialization",
	 "Register": 147,
	 "Value": 20,
	 "ResetRequired": true,
	 "ResetValue": 4,
	 "ResetWriteMode": "Set",
	 "Description": "Set EC to manual control"
	}
 ]
}